{
  "$schema": "../barkpark.template.schema.json",
  "manifestVersion": "1",
  "name": "astro-search-starter",
  "title": "Search Starter (Astro)",
  "description": "The flagship search site, statically generated: every document pre-rendered by the canonical PortableDoc at build, the corpus graph baked to JSON, live search browser-direct — pure static files, symlink-swap deploys.",
  "framework": "astro",
  "dataset": "production",
  "demoContent": true,
  "theme": "evergreen",
  "schemas": ["schemas/entry.json"],
  "seed": {
    "path": "seed.json",
    "format": "mutations",
    "publish": true,
    "publishType": "entry"
  },
  "env": [
    { "key": "BARKPARK_API_URL", "role": "server", "source": "api_url", "description": "Barkpark API base the BUILD reads from (the deployed site carries no token)." },
    { "key": "BARKPARK_TOKEN", "role": "server", "source": "read_token", "description": "Public-read token. Used at build AND inlined into the browser bundle for live search — never use a token above public-read." },
    { "key": "BARKPARK_DATASET", "role": "server", "source": "dataset", "description": "Dataset the build reads." },
    { "key": "BARKPARK_WORKSPACE", "role": "server", "source": "workspace", "description": "Workspace slug for scoped reads." },
    { "key": "BARKPARK_PROJECT", "role": "server", "source": "project", "description": "Project slug for scoped reads." },
    { "key": "BARKPARK_DOC_TYPE", "role": "server", "source": "literal", "value": "entry", "description": "The content type the site builds from — the seeded reference-rich entry corpus." }
  ]
}
